{
  "title": "Каталог БП: закупочная деятельность ООО «Альфа-Пример»",
  "documents": [{ "doc": "reglament-zakupok.md", "title": "Регламент закупочной деятельности" }],
  "processes": [
    {
      "id": "proc_procurement",
      "name": "Управление закупками",
      "level": "L1",
      "goal": "Своевременное обеспечение подразделений продукцией в рамках бюджета",
      "owner": "Отдел закупок",
      "participants": ["Инициатор закупки", "Руководитель подразделения", "Отдел закупок", "Финансовый отдел", "Юридический отдел", "Закупочная комиссия", "Бухгалтерия", "Склад"],
      "systems": ["1С:Документооборот (СЭД)", "1С:ERP"],
      "sources": [{ "doc": "reglament-zakupok.md", "section": "S1.1", "quote": "определяет порядок планирования закупок, проведения закупочных процедур, заключения договоров, приёмки и оплаты" }],
      "coverage": "full",
      "confidence": "explicit",
      "status": "proposed"
    },
    {
      "id": "proc_planning",
      "name": "Планирование закупок",
      "level": "L2",
      "parent": "proc_procurement",
      "trigger": "Ежегодно, до 1 ноября",
      "result": "Годовой план закупок утверждён",
      "owner": "Отдел закупок",
      "participants": ["Руководитель подразделения", "Отдел закупок", "Финансовый отдел", "Генеральный директор"],
      "sources": [
        { "doc": "reglament-zakupok.md", "section": "S2.1", "quote": "Ежегодно до 1 ноября руководители подразделений формируют потребность" },
        { "doc": "reglament-zakupok.md", "section": "S2.4", "quote": "План закупок утверждается генеральным директором до 15 декабря" }
      ],
      "coverage": "full",
      "confidence": "explicit",
      "status": "proposed"
    },
    {
      "id": "proc_purchase",
      "name": "Проведение закупки",
      "level": "L2",
      "parent": "proc_procurement",
      "trigger": "Заявка Инициатора в СЭД",
      "result": "Поставщик выбран, проект договора подготовлен",
      "owner": "Отдел закупок",
      "participants": ["Инициатор закупки", "Руководитель подразделения", "Финансовый отдел", "Отдел закупок", "Закупочная комиссия"],
      "systems": ["СЭД", "1С:ERP"],
      "aliases": ["Закупочная процедура"],
      "sources": [
        { "doc": "reglament-zakupok.md", "section": "S3.1", "quote": "Основанием для закупки является заявка Инициатора, оформленная в СЭД" },
        { "doc": "reglament-zakupok.md", "section": "S3.8", "quote": "По результатам выбора поставщика Отдел закупок готовит проект договора" }
      ],
      "coverage": "full",
      "confidence": "explicit",
      "status": "proposed"
    },
    {
      "id": "proc_rfq",
      "name": "Запрос котировок",
      "level": "L3",
      "parent": "proc_purchase",
      "trigger": "Стоимость не более 500 000 руб.",
      "result": "Выбрано предложение с наименьшей ценой",
      "owner": "Отдел закупок",
      "sources": [{ "doc": "reglament-zakupok.md", "section": "S3.5", "quote": "направляет запрос не менее чем трём поставщикам из реестра поставщиков" }],
      "coverage": "partial",
      "confidence": "explicit",
      "status": "proposed",
      "notes": "Описан одной фразой: нет сроков ответа и сценария «меньше трёх ответов»"
    },
    {
      "id": "proc_tender",
      "name": "Проведение тендера",
      "level": "L3",
      "parent": "proc_purchase",
      "trigger": "Стоимость свыше 500 000 руб.",
      "result": "Победитель определён протоколом комиссии / тендер не состоялся",
      "owner": "Отдел закупок",
      "participants": ["Отдел закупок", "Закупочная комиссия"],
      "aliases": ["Конкурентная процедура"],
      "sources": [
        { "doc": "reglament-zakupok.md", "section": "S3.6", "quote": "Отдел закупок готовит тендерную документацию и публикует извещение" },
        { "doc": "reglament-zakupok.md", "section": "S3.7", "quote": "Если на тендер не подано ни одной заявки, тендер признаётся несостоявшимся" }
      ],
      "coverage": "full",
      "confidence": "explicit",
      "status": "proposed"
    },
    {
      "id": "proc_contract",
      "name": "Согласование и заключение договора",
      "level": "L2",
      "parent": "proc_procurement",
      "trigger": "Проект договора подготовлен",
      "result": "Договор подписан сторонами и зарегистрирован в СЭД",
      "owner": "Отдел закупок",
      "participants": ["Отдел закупок", "Юридический отдел", "Финансовый отдел"],
      "systems": ["СЭД"],
      "sources": [
        { "doc": "reglament-zakupok.md", "section": "S4.1", "quote": "Проект договора согласуется Юридическим отделом в течение 3 рабочих дней" },
        { "doc": "reglament-zakupok.md", "section": "S4.3", "quote": "Подписанный поставщиком экземпляр регистрируется в СЭД" }
      ],
      "coverage": "full",
      "confidence": "explicit",
      "status": "proposed"
    },
    {
      "id": "proc_acceptance",
      "name": "Приёмка продукции",
      "level": "L2",
      "parent": "proc_procurement",
      "trigger": "Продукция поставлена",
      "result": "Продукция принята / направлена претензия",
      "owner": "Склад",
      "sources": [{ "doc": "reglament-zakupok.md", "section": "S5.1", "quote": "Поставленная продукция принимается Складом по количеству и качеству" }],
      "coverage": "partial",
      "confidence": "explicit",
      "status": "proposed"
    },
    {
      "id": "proc_payment",
      "name": "Оплата поставки",
      "level": "L2",
      "parent": "proc_procurement",
      "trigger": "Продукция принята",
      "result": "Оплата проведена",
      "owner": "Бухгалтерия",
      "sources": [{ "doc": "reglament-zakupok.md", "section": "S5.2", "quote": "в течение 5 рабочих дней после приёмки" }],
      "coverage": "partial",
      "confidence": "explicit",
      "status": "proposed"
    },
    {
      "id": "proc_supplier_eval",
      "name": "Ведение реестра и оценка поставщиков",
      "level": "L2",
      "parent": "proc_procurement",
      "trigger": "Ежегодно",
      "owner": "Отдел закупок",
      "sources": [{ "doc": "reglament-zakupok.md", "section": "S5.3", "quote": "Отдел закупок ведёт реестр поставщиков и ежегодно проводит оценку поставщиков" }],
      "coverage": "mention",
      "confidence": "explicit",
      "status": "proposed",
      "notes": "Только упоминание — порядок оценки и критерии не описаны"
    }
  ],
  "gaps": [
    { "id": "G1", "severity": "high", "process": "proc_purchase", "text": "Противоречие: срок рассмотрения заявки руководителем — 2 рабочих дня (п. 3.2) и 3 рабочих дня (Приложение 1)", "question": "Какой срок действует: 2 или 3 рабочих дня?" },
    { "id": "G2", "severity": "high", "process": "proc_tender", "text": "Не описано, что происходит после признания тендера несостоявшимся (п. 3.7)", "question": "Повторный тендер, закупка у единственного поставщика или отмена закупки? Кто принимает решение?" },
    { "id": "G3", "severity": "medium", "process": "proc_purchase", "text": "При отсутствии бюджетного лимита заявка отклоняется (п. 3.3), но не указано, уведомляется ли Инициатор и можно ли перераспределить бюджет", "question": "Кто и как уведомляет Инициатора? Есть ли процедура перераспределения лимита?" },
    { "id": "G4", "severity": "medium", "process": "proc_contract", "text": "Не указан подписант договора со стороны компании и действия, если поставщик не подписал договор", "question": "Кто подписывает договор (по доверенности/лимитам)? Какой срок ожидания подписи поставщика?" },
    { "id": "G5", "severity": "medium", "process": "proc_rfq", "text": "Не описан сценарий, когда ответили меньше трёх поставщиков или не ответил никто", "question": "Допустим ли выбор при одном-двух предложениях? Какой срок ответа на запрос?" },
    { "id": "G6", "severity": "medium", "process": "proc_acceptance", "text": "После претензии (п. 5.1) не описано: замена, возврат, влияние на оплату", "question": "Блокируется ли оплата до урегулирования претензии?" },
    { "id": "G7", "severity": "low", "process": "proc_planning", "text": "Не указано, кто корректирует план после возврата Финансовым отделом (п. 2.3)", "question": "План корректирует Отдел закупок или подразделения-заказчики?" },
    { "id": "G8", "severity": "low", "process": "proc_purchase", "text": "При отклонении заявки руководителем не описано, может ли Инициатор доработать и подать её повторно", "question": "Повторная подача — та же заявка или новая?" }
  ]
}
